msg_content,msg_id
"Илья Бирман нашел в Эпл картах кнопку погоды, которая раскрывается в попап, и пока раскрывается, два раза ресайзится. Нехорошо, говорит. Если все размеры заранее известны, ну нарисуй ты сразу окно нужного размера, а потом грузи свои данные в фоне потихоньку, и показывай по мере загрузки их сразу в том месте, где они в итоге окажутся.  Я тоже считаю, что нехорошо. Раньше нативные приложения отличались от веба именно тем, что ничего не дергалось и не прыгало при загрузке. Данные все локально, лайаут известен — чему там дергаться? Даже курсор поверх кнопок не менялся на руку, чтобы не дребезжало.  Однако веб с его релайаутом раз в секунду, картинками неизвестного до загрузки размера и CSS-ом, который может не успеть, сделал дребезжание вариантом нормы. И теперь мы видим это и в нативных приложениях, потому что — ну а что такого? Все так делают.  А какие-нибудь основанные на Электроне вообще показывают белый экран пару секунд, пока грузятся. И это тоже как бы нормально. Хотя — опять же — раньше такого никто себе не позволял. Если что-то загружалось две секунды, это считалось позором и хотя бы сплеш-скрин рисовали на это время.  Я все хочу снять как-нибудь видос, как я работаю на компьютере и открываю всякие повседневные штуки типа Идеи/Фигмы/Фотошопа, только вырезать все моменты ожидания загрузки. Ну или сократить до, скажем, 100 мс. Наглядно проиллюстрировать, как мы могли бы жить при сегоняшнем-то уровне развития железа. Потому что мы как-то привыкли, что вот ты вбиваешь адрес и секунду-две ждешь, прежде чем что-то появится. А ВЕДЬ ТАК БЫТЬ НЕ ДОЛЖНО.  Технически ничего вообще не мешает ни одной программе открыться за 16 миллисекунд, диски позволяют за это время сколько, мегабайт 50 прочитать? Но это надо программировать аккуратно, конечно. Если неаккуратно, то я на 100 мс согласен.",372
"Как и любой программист, я одновременно и мечтаю, и страшно боюсь момента, когда начну писать свой язык программирования. Но язык — не библиотека, спешки не любит, поэтому идеи для него я собираю неспеша. Вот некоторые из них.  Во-первых, это явно будет не язык, а полный стек разработки. Сборка, управление зависимостями, деплой, мониторинг — все будет встроено сразу. Чтобы можно было написать десять сточек бизнес-логики, нажать кнопку и получить работающее приложение сразу, а не нанимать на месяц девопса. Просто потому что по-другому мы уже пробовали и по-другому не работает.  Почти наверняка этот язык не будет соревноваться с C или Rust, потому что — а смысл? Эти языки уже есть и задачи свои решают. Хочется пробовать то, чего еще нет.  Во-вторых, он будет интернет-ready. То есть каждая функция будет иметь уникальный во всем мире идентификатор и зависимости будут тоже per function. Как js-пакет из одной функции типа is-color-red, только без вот этого вот кошмарного оверхеда на деплой и обслуживание. Написал import tonsky/str-concat; и у тебя сразу эта функция доступна.  Ну и иммутабельно это все будет, конечно. Нужно что-то поправить — выпускай новую функцию. Иначе не взлетит.  В-третьих, понятно, свой редактор. С одной стороны «код — это текст» я конечно уважаю и понимаю, что еще ни один язык с кастомным редактором не взлетел. Но с другой стороны, столько вещей, которые тупо нельзя сделать, если жить в предположении, что кто угодно может как угодно в любой момент изменить ваш исходник внешними средствами.  Самое простое — CRDT-based версионирование. На плоских файлах тупо не делается, а выгоды сулит огромные. Посимвольный blame, например, гарантированный автоматический мерж (и анмерж), ну и понятно Google Docs-лайк коллаборация.  Другая моя давняя мечта — картинки в комментариях. Многие вещи ГОРАЗДО проще нарисовать, чем описать словами, однако текстовость файлов мешает. Как минимум редактор диаграмм надо будет точно встроить. Прикиньте — рисовать нормально, а не ASCII-графикой?  Разные шрифты, чтобы можно было, например, выделить болдом что-то важное. Но тут надо будет подумать, как не дать слишком много контроля программистам, потому что с визуальным вкусом могут быть вопросики.  Ну и наконец можно будет сделать красиво. Нормальные юникодные операторы (π, ≠, ¬, ∧, ∨) вместо этой дурацкой псевдографики >>=, типографские кавычки для строк (да, открывающая и закрывающая кавычки будут разными!). Табы, опять же, убрать. Как и пробелы 🙂 Выравнивание сделать семантическим, а не захардкоженным десятью нажатиями на самую длинную клавишу на клавиатуре.  Возможно, социальные фичи типа комментариев от других людей и таск трекинга прям в коде. А почему нет? У писателей это все есть, у дизайнеров есть, причем для них это сделали программисты. А сами себе мы почему не можем сделать то же самое?  В-четвертых, мнгновенная реакция. На все — изменения, импорт зависимостей, сборку, деплой. Никакого ожидания «пока скомпилируется». Да, возможно, какая-то часть перформанса останется на полу, но оставшейся, я уверен, хватит с головой.  Ну и REPL, конечно, куда без него. «Редактирование наживую». Перезапускать программу, чтобы тупо посмотреть, правильно ли ты там что-то поменял — ну, такое. Удовольствие для терпеливых.  В-пятых, база данных будет прямо в стандартной библиотеке. Потому что она ну все равно нужна всем, а настраивать, подключать, сериализовывать-десериализовывать, конвертировать между реляционным и объектным представлением... Я лично устал. Не вижу смысла.  Представляете, в каком светлом мире мы бы жили, если бы в линуксе каждый сервис не хранил свой конфиг в уникальном как снежинка текстовом формате, а пользовался бы единой SQL-базой? Углеродный след раза в три бы уменьшился по всей планете, а освободившиеся админы связали бы каждому живущему человеку по два шарфика за это время.  А, ну и массивы будут индексироваться с единицы, конечно же. Или нет. Пока не решил.  Короче, как видите, работы много, так что я пойду и дальше мечтать. Привет.",373
"Короче. История.  У меня в веб-клиенте твиттера перестали работать видео. Ну то есть не совсем перестали, но включаются со второго раза, а при малейшем скролле ставится на паузу. Продолжить можно, но мышкой лучше не шевелить.  Первая мысль, конечно — ха! Опять эти хипстеры из Долины перепили сельдереевого латте, перегрелись на горячей йоге и все сломали. Жду день, неделю, месяц. Ну не может быть так долго сломано, даже по стандартам силиконовой долины это чересчур!  Вторая — может, адблок? И действительно, захожу в консоль, вижу заблокированный client_event.json, отключаю адблок и все снова работает. Сам себе злобный папа Карло, получается? Почему загрузка какого-то там JSON-а блокирует видео — ну, видимо, фронтенд фреймворк так сделан, нельзя требовать, чтобы они еще и с адблоком работу сайта проверяли.  Ладно. А почему видео ставится на паузу при скролле? Так вот потому что этот client_event.json при каждом скролле и отправляется. При каждом, Карл! Даже на миллиметр. Более того, он еще отправляется при каждом ховере. То есть навел на любую кнопку (не нажал!) — получи двадцать килобайт исходящего трафика. Ага, двадцать.  Что такого важного он там отправляет, что видео не может продолжить играть? Ну, например строчку ""debug"": ""true"" (да, значение тоже именно строкой), или ""element"": ""users_liked_mention_of_you"", ""client_event_sequence_start_timestamp"":1661273470663, ""client_event_sequence_number"": 152 (уверен, названия специально выбраны самые короткие чтобы экономить ваш и без того нерезиновый трафик), или 800 байт непрозрачной метадаты, которая, кажется, закодирована в base64 и декодируется примерно в то же самое (!!) сообщение. Или высоту вашего экрана ""percent_screen_height_100k"": 15936 (а вдруг при ховере поменяется?), или вот этот вот супер-важный бит информации: ""video_type"":""video"", или id видео, повторенное пять раз (да, пять).  В общем, сломал ли я сам себе Твиттер и теперь на него жалуюсь? В известном смысле — да. Но с другой, разве не нужно быть сумасшедшим, чтобы позволить такой вот ерунде есть вашу батарейку, трафик, CPU и нервные клетки? Разве не большее безумие НЕ блокировать client_event.json? Разве не безумно следить за каждым вздохом, пуком и размером зрачка каждого человека, зашедшего на твой сайт?  Сколько вообще Твиттеру нужно знать, вот на самом деле? Каждый шорох мышки, каждый ховер, каждый скролл, размер экрана, устройство, браузер, время суток. Когда им окажется достаточно? Где эта черта? Неужели с этой информацией можно сделать что-то осмысленное, даже если в гиганстских масштабах загрузить ее всю в машин лернинг?  Ну построил ты датаценр и прогнал через него триллион двадцатикилобайтных событий в день, в итоге получил информацию типа 35% пользователей сидят на десктопе, 65% на мобиле. И ЧО? Кто-то наверху посмотрел на эти цифры и такой: нормально, ничего не меняем, работаем дальше. Причем не каждый день даже смотрел, а там раз в месяц. Или в год даже. Неужели оно того стоит? Ну то есть понятно, что пять тысяч программистов надо чем-то загрузить, строительство дата центров надо чем-то оправдывать, а тут как раз такая мощная задача.  Но какой во всем этом СМЫСЛ?",374
"Кстати, в посте про дергающуюся погоду на Яндекс^W Эпл Картах был еще один показательный момент. Чтобы эту погоду посмотреть, надо нажать на иконку и ПОДЕРЖАТЬ. При том, что все остальные кнопки работают от обычного тапа. Собственно, изначально это штука и разлетелась как открытие — смотрите, как, оказывается, можно.  И вот это вымораживает меня в мобильных интерфейсах больше всего. Что многие взаимодействия тупо спрятаны и передаются фольклором: смотри, знал, что так можно? А догадаться самому практически нереально: где можно подержать, где свайпнуть, где потянуть до определенного предела или, наоборот, сверх предела. Ничего же не нарисовано, даже малюсенького намека нет.  Показывал жене недавно, как вызвать поиск приложений на айфоне: это свайп вниз с середины экрана. На что она справедливо заметила: погоди, но свайп вниз же вызывает нотификации! Да, результат зависит от того, в каком примерном, никак не обозначенном месте экрана ты начал жест.  Чемпион в этом виде спорта — приложение Procreate. Даже мне, видевшему многое, пришлось-таки гуглить, как делаются некоторые вещи (свайп тремя пальцами, перетаскивание какого-нибудь индикатора куда-нибудь, ожидание после начала рисования). Особенно кайфово было, когда они в какой-то версии поменяли один невидимый жест на другой и пришлось гуглить снова! Это при том, что у них на панели большая часть места пустует.  Вроде бы очевидно, что в интерфейсостроении спрятанная, скрытая функциональность — зло. Что если человеку не подсказать, то он про функцию, может, никогда и не узнает. Но почему-то мобильные дизайнеры решили, что им можно. И мы оказались в мире, где новые функции открываются случайно, а Ютуб заполнен видео «20 функций вашего телефона, о которых вы не знали».  Не надо так.",375
"Вдогонку: у невидимых контролов есть большая проблема: их очень сложно критиковать.  Ты говоришь разработчикам «у вас нельзя сделать то-то», а они тебе «так можно же, вот тут отодвинь и семь секунд подержи». Вроде бы и проблему твою решили, и функция присутствует, и ты про нее теперь знаешь — на что жаловаться?  Получается, что не на что. Да, все остальные точно так же, как и ты, не смогут ее найти, но каждый раз, когда кто-то будет поднимать бучу, ему покажут, бага не заведут, исправлять мотивации не будет. Все, у кого была проблема, сами себя затыкают, а зачем шевелиться, если никто не жалуется?  Так и живем.",376
