msg_content,msg_id
"Помните в детстве, запах лета, бег по траве босиком, ноги, мокрые от росы, молоко свежее, парное, прямо из-под коровы, летнее поле, жужжащее пчелами и шуршащее травой на ветру, и как ты бежишь скорее домой, из леса, по полю, через ручей, наступаешь в коровью лепешку, собираешь по дороге охапку одуванчиков, моешь ноги в колонке, босиком забегаешь в дом, а там печка, теплая еще с обеда, и вся семья сидит кто на чем, вокруг телевизора, такого, старого еще, с ручками-крутилками, кто с семечками, кто с арбузом, и ты, затаив дыхание, волнуешься: не опоздал? Не слишком поздно?  Нет, успел. И сразу отлегло, и сразу на душе тепло, уютно и очень спокойно.  И вот в телевизоре начинается передача, на сцену выходит Стив Джобс, тараторит что-то там по-английски, и диктор старается, переводит, но все равно отстает, а ты все равно понимаешь: вот прямо сейчас, здесь, у тебя на глазах, в поселке Голубево Астраханской области, творится история.  Это я к чему? Все, Эпл уже не тот. Нет больше такого ощущения от презентаций почему-то.",119
"Я там угарал в твиттере, мол, что за фигня, статусы для Do not disturb режима. Не просто выключить нотификации, а выключить их с названием. На что мне возразили, мол, полезная же фича?  Не знаю как вы, а я DND вообще не пользуюсь. Точнее, как — у меня полный и постоянный DND и на телефоне, и на компьютере. Все каналы замьючены, все нотификации выключены, приложения-коммуникаторы на компе по дефолту закрыты, звук замьючен. Всегда, а не в какие-то особенные периоды концентрации.  Потому что ну бред же, только вслушайтесь: если я не в Do not disturb режиме, значит я что, в disturb режиме? Беспокойте меня, дергайте, отвлекайте? Странно звучит, да?  Нет, если я работаю, то конечно, меня не отвлекайте. Но и если я отдыхаю, нафига мне чужие заботы? Нет таких нотификаций, о которых нужно было бы узнать в ту же секунду, и нет сообщений, которые не могли бы полежать неотвеченными до вечера. Да, некоторые люди думают, что отвечать на директ нужно сразу же, и ожидают этого от окружающих — но это их, странных, проблемы.  Поэтому я за pull модель, а не push — когда у меня есть время и я об этом вспоминаю, могу дойти до телефона и глянуть, не набежало ли там чего важного.  А могу и не дойти. Значит я что-то более интересное в это время делал. Или просто забыл. Как-то раз я несколько дней подряд забывал проверить почту — лучшее время в моей жизни.  Рекомендую.",120
"Учился я в универе на программиста, и сдавали мы какую-то лабу. Я как прилежный отличник все сделал заранее, скучал и ходил подслушивал, как сдавали другие. И вот сокурсник показывает решение и начинает объяснять его словами (дело было на языке Эс): «тут вот я делаю #typedef float my_float, чтобы если потом захотелось поменять, то это делалось в одном месте». И препод такой — ага, ага.  Конечно, лабу эту после этого дня никто ни разу в жизни не открывал.  Потом я попал на работу на Джаве, а там такая практика: каждому классу делаем интерфейс, а рядом кладем класс, его реализующий. Типа, вмето BedaController делаем IBedaController и BedaControllerImpl.  Я, наивный, спросил: а нафига? Нафига интерфейс, если реализация только одна? Мне сказали, что это best practice на случай, если понадобится вторая реализация.  Как часто на самом деле появлялась вторая реализация? На моей памяти — ни разу.  Потом я работу поменял, и вспоминая, как мы намучались с Гибернейтом на предыдущей, спросил «архитектора»: нафига вы тоже в это вписались? Он говорит: ну в смысле? А вдруг базу захотим поменять? А Гибернейт ее абстрагирует.  И что, сколько раз меняли уже, говорю? И, главное, зачем ее вообще менять?  Чувак реально психанул, сказал что я дебил если очевидных вещей не понимаю, и убежал. Контора через пару лет закрылась, преимущества абстрагированной базы ее почему-то не спасли.  Это я все к чему? Все очень просто: никто не может угадать будущее. Это вроде бы очевидно, но сплошь и рядом люди пытаются сделать именно это, и очень часто ошибаются.  Поэтому надо из этой простой предпосылки и исходить: мы не знаем, что нам понадобится через час/месяц/год, а значит, и готовить заранее ничего не надо.  Придет время выделить интерфейс — возьмешь и выделишь. С современными ИДЕ это совсем не страшно. Придут к тебе с просьбой добавить вторую базу — засучишь рукава и добавишь. А пока не пришли, ты и силы зря потратишь, и нормально все равно не сделаешь.  Потому что расширямость без настоящей потребности — она такая, мнимая. Когда приходят за расширением по-настоящему, быстро понимаешь, что все, что ты городил до этого «впрок» — это влажные фантазии, и в реальном деле они не особо-то и помогают.  А когда есть настоящий запрос, то и делать проще — ты уже знаешь, что конкретно и почему, и решение пишется само собой. Потому что фантазировать не надо.",121
"Нажать и подержать — самый уебищный жест из возможных.  Это все треклятый минимализм, когда рисовать простые и видимые контролы стало почему-то стыдно, а вот заставлять людей заучивать магические комбинации из свайпов N пальцами с четырех сторон света в вакууме — почему-то нет. Желание спрятать действие, наложенное на отсутствие правой кнопки в указательном пальце.  Свайпы, впрочем, ладно: раз в неделю затупишь, но потом или вспомнишь, или нагуглишь. Но нажать и подержать? Это абсолютно проклятый жест по одной простой причине: он заставляет человека ждать.  Я (и любой другой уверенный пользователь писи) могу десятки жестов в секунду генерировать, если компьютер за мной поспевает. И ладно если бы он тормозил от сложности задачи или убогости разработчиков — их хотя бы можно понять!  Но «подержать» — это абсолютно специально и умышленно наложенное вредительство, не обусловленное ничем. Участок 10 км/ч посреди автострады. Вечность, за которую я успеваю написать и переписать в голове два поста. Канализационный люк без лестницы, который нельзя обойти. Сломанная нога в чемпионате мира по бегу. Непонятно откуда взявшийся перекус на чай в смертельном бою двух самураев.  Я не фанат, короче.",122
"Я тут упражнялся с Zig и Rust-ом и нашел ключик -march=native, который, как я понял, компилирует код специально под текущий процессор. Ключик этот поднял перформанс Раст версии раза в два, что нехило, да? (В Zig он включен по умолчанию).  Я так понимаю, это связано с тем, что компилятор смог заюзать продвинутые инструкции конкретно моего процессора, а без него компилял только в самый общий сабсет x86_64.  В связи с чем вопрос: а как это работает в жизни-то? Вот я скачиваю бинарник программы, написанной на каком-нибудь C/C++/Rust/Go/Haskell, нажимаю на .exe, и что, она работает в два раза хуже, чем могла бы на моем конкретно процессоре?  Если нет, то как тогда это работает? А если да, то какой вообще план? Нахера процессоры вообще развивать тогда?  И правильно ли я понимаю, что JIT-ы потенциально могут эту проблему обойти, потому что генерят машинный код в момент запуска? Обходят ли? Ну там JVM/.NET/V8?",123
"Немногие знают, но у цветов в компьютере есть единица измерения. Вот эти вот R, G, B ∈ {0..255} это только пол-дела. Так же как и у «1 км» есть «1» и есть «км».  У цветов вместо «км» цветовое пространство — sRGB, DCI (P3), Rec.709, Adobe RGB. Смысл такой, что (255, 0, 0) в sRGB это совсем не то же самое, что (255, 0, 0) в P3. Ну или наоборот, фирменный цвет Кока-колы это (244, 0, 0) в sRGB и одновременно (224, 48, 33) если в P3. Хотя физически это один и тот же цвет. То есть при переводе цифры меняются, а цвет (физический) остается.  А дальше начинается цирк под названием «угадай, где мы проебали размерность». Ну знаете, когда в физической формуле вы считали рост, а получили кг/см³.  Цветовые пространства есть где? В фотоаппарате, в картинке с фотоаппарата, и в мониторе (ну, и в принтере). Можно предположить, что все они одинаковые, и нигде ничего не конвертировать. Тогда (и только тогда!) если они действительно одинаковые, это даже будет работать.  Так оно и сходило программистам с рук: мониторы-то все были sRGB, а остальное под них подстраивалось. Поэтому взять непонятно откуда три цифры и положить эти же самые три цифры куда-то еще считалось вполне нормальным.  Блин, для этого даже термин специальный придумали — Unmanaged Color Space. Это значит что мы берем значение в километрах, отрезаем от него единицу измерения и подставляем в формулу вместо градусов цельсия. Готово, вы великолепны!  Unmanaged Color Space — это как если бы на телевизоре была на полном серьезе опция «показывать хуйню». Цветовое пространство есть всегда, алло! Если закрыть глаза, оно не исчезнет.  Но как же, скажете вы. Я вот пишу на сайте #00FF00, чтобы покрасить ссылку в синий, тут нет цветового пространства же? Ну, во-первых, #00FF00 — это зеленый, а во-вторых, есть. sRGB как раз. Все цвета во всех местах в веб-программировании указываются в sRGB. Это, конечно, пост-фактум решили, но хотя бы решили.  Свинью программистам подожил Эпл, когда решил, что может сделать монитор покруче, чем sRGB. Тут-то непонимание происходящего и полезло наружу. Например, Файрфокс показывал один и тот же hex-цвет по-разному в разных местах: на color, на градиенте, на sRGB картинке с цветом, на не-sRGB картинке с цветом и на видео. Все рендерились по-разному, блин!  Проблему усугублял тот факт, что пресловутый P3 на практике очень близок к sRGB. Добавьте сюда внешнее освещение, неточности монитора, настройки, Night Mode, True Tone, короче, отличить (0, 255, 0) зеленый в sRGB и (0, 255, 0) зеленый в P3 непростая задача, если только их специально рядом не поставить.  Поэтому, собственно, никто и не трубит тревогу и не гнобит популярные приложения за неправильную интерпретацию цвета. Точно так же, как во времена раннего Макоса (гамма 1.8) легко можно было открыть картинку с Винды в гамме 2.2 и ничего не заметить. Чуть засвечено, но кто ж его знает, как оно на самом деле должно быть. Программистам было настолько на это пофиг, что сам Эпл прогнулся и поставил в итоге Виндовую гамму в 10.6.  А сегодня легко можно вывести sRGB буфер на DCI-P3 монитор и никто не пикнет. Цвета чуть выжжены, но как ты узнаешь об этом, если рядом не поставишь sRGB монитор?  Не верите? Мак 2016+? Пользовались Файрфоксом, OBS, Фигмой, Идеей? У меня для вас плохие новости.  Мораль какая? Когда вы жмете кнопку на фотоаппарате, он пишет на SD-карту циферки. Это циферки в каком-то конкретном цветовом профиле, который он пишет в тот же файл. Когда вы шлете картинку на монитор — он их покажет тоже в определенном цветовом пространстве, поэтому их нужно в это пространство предварительно сконвертировать. Нельзя взять (255, 0, 0) из sRGB картинки и послать (255, 0, 0) на P3 монитор — вы увидете сильно более яркий красный.  Зато если все сделать правильно, то монитор будет стрелять в вас точто такими же фотонами, какими стреляли в фотографа трусы японской школьницы в момент спуска затвора на фотоаппарате. Вы увидите физически тот же самый цвет.  Разве не круто?",124
"Самое проклятое изобретение в IDE/редакторах кода это нотификации. Казалось бы, жили спокойно, писали код, но тут кто-то придумал что надо бы о важных событиях пользователя оповещать, как в телефоне. И сделали нотификации.  А нотификации это что такое? Это когда программе от тебя что-то нужно. То есть ты работаешь, занят своим чем-то, и тут ба: чувак, оторвись, у меня к тебе важное дело.  И ладно бы это какой-то эфемерный попап был, который пропадет через секунду. Самый треш пошел, когда в VS Code сделали целый нотификейшн центр блин! В котором, натурально, все эти хотелки копятся и их нужно разгребать. Да, даже неактуальные. А не будешь разгребать – будет тебя счетчиком непрочитанных доставать.  То есть модель работы сменилась с «тулза делает то, что мне нужно» на «я разгребаю хотелки тулзы, которая может прервать меня в любое время».  «Но как же!» — скажет неравнодушный читатель. «Иногда ведь и правда нужно пользователя о чем-то оповестить!».  Не нужно. В Sublime Text вообще нет механизма ни для каких нотификаций, даже для попапов. И ничего, работает как-то, пользу приносит.  Все эти оповещения — они от неуверенности в себе и от желания напомнить о себе, навязать пользователю еще раз свое присутствие. А не от какой-то реальной необходимости.",125
"Вообще программирование покатилось вниз по наклонной, когда разрешили вещи от программиста прятать. Типа, вот явное – то, что написано в буквами в файле, буквально. И все остальное, неявное, что нужно держать в голове. Например, «автовыведенные» типы в ML-е, или ресиверы в Котлине, или проперти синтакс, который на самом деле зовет методы, или перегрузка операторов, или автоматические конверсии типов в Скале.  Проблема в том, что это самое «неявное», незаписанное есть только в голове того, кто писал этот код, и то недолго. А код, как известно, в сто раз чаще читают, чем пишут. Поэтому прятать что-то – плохая идея.  Тут даже ИДЕ не помогает, потому что когда ничего не написано, то и мышкой нажать не на что.  Тяжелый день на работе, ага.",126
"Вообще программирование покатилось вниз по наклонной, когда в 90-е гг. стало ясно, что на Западе его вытесняют мощные фирмы С++. А когда в 2000-е на рынок вышли мощные и быстрые системы, способные работать на старых компьютерах, программисты начали понимать, что в России их навыки никому не нужны. Так вот, я считаю, что надо сделать все, чтобы остаться. Надо быть конкурентоспособным на мировом уровне, надо использовать современные методики... — Это уже сложнее. — Я не знаю, как это сделать. У меня есть несколько идей, которые пока не реализованы.  Осторожно! Текст выше сгенерирован компьютером. Понравилось? Поняли что-нибудь?  Вообще нейросети классно, особенно в задачах распознавания. Но вот именно в генерации не очень понятно, какой должен быть переход от складывания бессмысленных предложений к сильному ИИ (или какая у них конечная цель?).  Те, кто предрекают, глядя на это, что нас всех скоро заменят компьютеры, забывают, что упаковать что-то под требуемую форму — действительно, автоматизируемая задача, но также и самая простая часть работы человека. Форма вообще имеет смысл, если внутри есть хоть крупица смысла, содержания. А без него ты просто потратишь ресурсы впустую на расшифровку. Как говорили в одном хорошем фильме, «движение есть, прогресса нет».  С другой стороны, половина текстов в интернете (да и в книгах) примерно такого же уровня — читаешь, читаешь, а зачем – непонятно. Так что может быть, это ближе к человеку, чем мне кажется?",127
Мой любимый способ троллить джавистов следующий:  — Зачем вы делаете геттеры/сеттеры? — Чтобы в будущем иметь возможность засунуть в них функциональность. — Но у вас же лучшие в мире ИДЕ? — Да. — Понадобится засунуть — зарефакторите.  Молчание.,128
