msg_content,msg_id
"Не знаю как вас, но многих впечатлила демка The Matrix Awakens на Unreal Engine 5. И я уверен что там много подкапотных улучшений именно для создателей игр, включая упрощение производства, глобальные и единые системы освещения и детализации, которые «просто работают», система генерации ассетов и т.п. Безусловно, это изменит экономику создания игр, что очень важно.  И мне очень жаль, что я не могу в полной мере этим всем впечатлиться из-за... latency. Да, оно производит красивые статичные картинки (если выключить зеленый фильтр, ололо), но в динамике, как только что-то происходит — едет машина, поворачивается камера — оно происходит с видимой задержкой в несколько фреймов.  Оно и понятно — UE5 это шаг в сторону «честного» расчета света, отражений и теней, чтобы художникам не надо было трястись над каждой сценой отдельно. И это шаг в правильном направлении, конечно, но, к сожалению, сегодняшнее железо не может обсчитать ВСЮ картинку за каждый кадр. Вместо этого информация об отражениях, тенях и даже пикселях (да?) накапливается несколько кадров и потом как-то аппроксимируется, то есть усредняется, заполняя пропуски (я не эксперт, знаете, что там происходит — расскажите!)  И как я уже сказал, картинка — супер, но задержка — полный атас, как будто опять в детство попал, родители не хотят апгрейдить комп, а поиграть в современные игры хочется.   Обидно, что как только я заработал достаточно денег, чтобы позволить себе last gen, индустрия сделала резкий поворот и решила производить тормозящие игры by design. Кто как, а я за картинку попроще, но чтобы каждый кадр был «настоящим», а не «примерным». Стабильный высокий FPS >>> красивых статичных кадров, опоздавших на 50 мс. Да, я считаю, что Quake 3 на 240 Hz это в первую очередь впечатляюще и красиво. Ждем RTX 9090 Ti, может хоть на нем рейтрейсинг начнет нормально работать.",256
"История-то не заканчивается! Если в результате первой подстановки в паттерне появились новые переменные, Log4J их радостно продолжить подставлять :))) Пока залатали, ждем уязвимости и патча с третьим уровнем рекурсии.  Хочется, конечно, верить, что индустрия какой-то урок из этого извлечет, типа что сложность это плохо, а в среднем Джава коде примерно в 200 раз больше фич, чем того требует здравый смысл, но кого я обманываю. Залатают и продолжат брать log4j дальше и нахваливать, делая вид, что все отлично.",257
"Лев попросил написать, что наконец-то сделали язык с нормальными строками — Свифт. Нормальные — это когда ""🤦🏼‍♂️"".count == 1. Преимущества языка, выпущенного после 2001 года.  Каждый раз, когда вижу где-то неправильно обрезанные строки, в каком-нибудь условном превью сообщения («уважаемый Никита, идите в зад...», раньше по байтам, сейчас все чаще по кодпоинтам), думаю, что писали бы на Свифте — было бы нормально. Потому что defaults matter. Когда для того, чтобы что-то обрезать правильно, нужно ставить какую-то там библиотеку на 13 мегабайт (да, на 13 мегабайт), апдейтить ее дважды в год (да, дважды в год), конвертить строки туда-сюда, какие-то там итераторы создавать, да даже если бы этого всего не было и нужно было просто разобраться в проблеме, а тебе как всегда некогда, ты нелюбознателен и String::substring вот он, под рукой (а в подлом Питоне так и вообще неправильный способ выглядит как красивейшие `str[0:100]`), то конечно выиграет всегда второе. А проиграем мы, юзеры.  На моей памяти довольно редкий случай, кстати, когда язык программирования в противостоянии компьютера и человека занял сторону человека. Обычно же как: компьютеры работают вот так, поэтому и язык работает так же, а со своими людскими проблемами разбирайся сам.  Правильные строки — это когда вместо «как компьютеры работают» сделаем «как человеки работают», что довольно круто, как мне кажется. В смысле что язык помогает решать те проблемы, которые на самом деле возникают у людей, а не те, которые удобно решать компьютеру. Так что это, будете делать свой язык программирования — не продолбайте.  UPD: В Эликсире еще правильно String.length(""🤦🏼‍♂️"") == 1",258
"Вот уже три недели я решаю Advent of Code в прямом эфире. Это не первый мой заход, но пока что самый стабильный, с реальным шансом дойти до Рождества.  Зачем? Мне кажется, он тренирует несколько полезных навыков, которые в обычной жизни у меня слабо развиты.  Во-первых, решать быстро. Я вообще люблю все делать размеренно, подумать, погулять, подождать, когда придет хорошее решение. Адвент не про это — чем быстрее, тем лучше.  Во-вторых, он учит решать настоящую задачу, а не какую-то более сложную выдуманную вместо нее. Это важный концепт, но попробую ужать.  Допустим, в спорте обнаруживается какой-то очень простой, но мощный удар, который позволяет при минимуме тренировки побеждать очень часто. При этом он скучный, неинтересный, «подлый», но валидный. И очень уж хорошо работает.  Так вот, у людей, этим спортом занимающимся, могут возникнуть в голове некие «соображения совести», которые будут мешать им пользоваться, потому что «неправильно», «неэтично», «скучно», «так все могут». И тут-то собственно и вскрывается, что они не ради победы спортом занимаются и поэтому, возможно, у них и нет особых результатов. Они придумали себе более сложные, чем реально необходимо, условия и страдают, пытаясь в них существовать. Не надо так.  В программировании такое сплошь и рядом, но в первую очередь, наверное, там, где разводят архитектуру и инфраструктуру вместо того, чтобы написать простой перл-скрипт. И это нормально, естественно, но неэффективно, и хотелось бы научиться видеть и решать настоящие проблемы максимально эффективно, а не те, которые хочется или интересно решать.  И тут помогает Адвент. Для меня настоящий прорыв случился, когда я понял, что могу редактировать вход программы руками, если мне так удобнее. Формально там всегда есть один текстовый файл на вход, и, кажется, что надо бы в первую очередь написать его парсер. На практике парсер можно писать дольше, чем просто захардкодить значения. Сегодня, например, файл был такой:   Player 1 starting position: 1 Player 2 starting position: 3   Ну да, парсер написать несложно, но в этом нет смысла: не нужно писать программу, обрабатывающую все подобные файлы, нужно решить для конкретно вот этого, а он никогда не поменяется. Так же как Player 1 и Player 2 нет смысла абстрагировать: их всегда будет ровно два и ровно в таком порядке.  Или вот тоже сегодня я написал фунцию, складывающую семь векторов. Не шесть, не восемь, а именно семь: на любом другом количестве она работать не будет. И ничего, брат жив.  Третье чему учит Адвент это не планировать на будущее. У каждой задачи две похожие части с одним и тем же входом, но, пока не решишь первую, условие второй не видно. Можно попробовать угадать и приготовить какие-то заготовки на будущее, но довольно быстро становится понятно, что угадываешь ты редко, заготовки не так уж и сильно помогают, а поменять код, когда наконец появляются новые требования, не так уж и сложно. Прямо как в жизни.  Ну и четвертое важное это то, что программа здесь в общем-то никого не интересует. Отправлять код некуда, нужен только ответ на проблему — как правило, одно число или слово. Сможешь решить на бумажке — флаг тебе в руки, никто косо не посмотрит. Иногда программа нужна, чтобы понять проблему, а дальше уже включается человеческая смекалочка. Более того, программу даже не всегда можно написать. Короче, дрель никому не нужна, нужны дырки в стене. Прямо как в жизни!  Все в целом для меня такая когнитивно-поведенческая терапия. Даже если умом я понимаю все это, попробовать и увидеть, как эти принципы работают на практике, обжечься, ошибиться и сформировать правильные привычки — бесценно. Кроме того, писать медленно, решать не те задачи и автоматизировать ненужное я уже и так хорошо умею, почему бы не потренировать те навыки, которые проседают? Присоединяйтесь!",259
"Dominic Szablewski недавно опубликовал QOI: Quite OK Image format. Это примерно как PNG, только сильно проще, сильно быстрее и жмет почти не хуже. В качестве главного артефакта — спека, которая помещается на одну альбомную страницу.  Какое-то время назад я увлекался распределенными алгоритмами, и тогда на смену Paxos приходил Raft. У них тоже одна из целей была: Paxos работает норм, но въехать в него сложно, поэтому мы придумали новый протокол, который не хуже, но сильно проще понять и закодить. Это прям явно как одна из дизайн-целей заявлялось.  Оба этих случая бьют мне прямо в сердечко, конечно. Потому что не разводят сложность на пустом месте. Всегда есть этот баланс — сделать чуть лучше, но сильно сложнее, и многие не чувствуют, когда надо остановиться.  А второе — это что помимо придумывания надо еще и объяснить, и это часто важнее. Простота тут помогает, но и сама по себе цель благородная. Что толку от великого алгоритма, если его никто не может понять?  Академики тут, к сожалению, часто не блещут, и донести мысль до простых работяг вроде меня им бывает тяжело. Я поэтому предпочитаю пейперам блог-посты: их хотя бы пишут люди для людей, а не пользователи Латеха для владельцев А4 принтера.",260
This message is not supported in your version of Telegram. Please update to the latest version.,261
"Все, наверное, видели старую картинку, как в Слаке доставляются нотификации. Если не видели, то там такая развесистая блок-схема с кучей стадий и условий, и все не в какую-то понятную линию выстроено, а переплетено в клубок со стрелками назад и всякими прочими сложностями беспокойного ума.  И типа картинка эта преподносится под соусом «смотрите, сколько сил мы потратили и как устали^W постарались», мол, простота для пользователя — это не просто.  А я думаю, что она иллюстрирует другой постулат — сложность, она и есть сложность. Если вы придумали сложные правила, пользователям тоже будет сложно. Если ваша схема не помещается в голову разработчика, она не поместится и в голову клиента, у него не возникнет ментальной модели и он махнет на попытки разобраться рукой.  Это все из собственного опыта, конечно — я который год вынужденно сижу в рабочем Слаке, но не так, как любят любители панических атак, а пассивно: если мне что-то написали — отвечу, в остальное время просто Слак не открываю. Зачем?  И вот из-за этой их сложности, которая «нужна для простоты», я который год не могу настроить себе нотификации. Типа, я очевидно хочу видеть все DM и @mentions и ВСЕ. И вот это какая-то неразрешимая задача. На десктопе, понятно, без шансов (почему, кстати, пуши для десктопа до сих пор не завезли? Очевидная вроде фича?), но хотя бы на мобилке.  То есть там есть какая-то такая опция, но он начинает показывать всякие @all и @here тоже, хотя я, очевидно, не @here (в чем, кстати, тогда его отличие от @channel, если мне все @here прилетают all the time?).  Можно, конечно, настраивать нотификации отдельно для каналов, и там вроде как есть возможность отключить @here (но не @all) (это мне подсказали, кстати, сам бы не нашел), но это тридцать каналов и семь кликов на канал. Я конечно упорный, но не настолько.  А когда открываешь, он тебя еще бомбит непрочитанными сообщениями _в соседних воркспейсах_, которые тебя вообще не касаются. Я был бы не против сидеть в условном слаке Кложуристов (да и вообще во всех слаках, в которые меня когда-либо приглашали — вдруг кто заменшонит?), но это значит что каждый раз когда кто-то там что-то пишет (не мне!!!) я буду видеть красную лампу. Поэтому приходится максимально быстро выпиливаться.  И я уж не говорю про баги. Например, прямо сейчас у меня в канале висит один Unread, хотя я заходил туда уже миллион раз и как от него избавиться — хрен знает.  Понятно, что Слак делается для тревожных кисонек, которые сидят там 24/7 и обрабатывают миллион сообщений в день. И оно для них, наверное, работает, потому что какая в самом деле разница, когда и какие нотификации прилетят, если все равно в него заходишь каждые пять минут. Но вот для пассивного расслабленного использования а-ля емейл, когда важна надежность и предсказуемость нотификаций, он подходит слабо.  Почему-то у меня стойкое ощущение, что я про это где-то писал, но где — никак не найду.  С Новым Годом! (Бирмана — годом!)  💩74 🔥59 😁29 👍26 😱16 🤮10 🥲8 🎉6 ❤️4 🤩4 👎3",262
"На Новый год (Бирман, смотри, правильно написал!) в Москве прошел «Бал самозванцев» — «событие, на котором люди рассказывали о том, что у них не получилось в 2021 году». Я там не был, но идея понятна.  Так вот, вместо итогов года почему бы не поделиться, что у кого не получилось в 2021-м? Я начну:  — Убил то ли две, то ли три недели на то, чтобы подвинуть маковский «светофор» в JetBrains Fleet. И не сделал. Тупо сдался.  — Не прошел собеседование в Nubank. Сказали, что слишком «индивидуальный».  — Пытался делать сайд проект, начатый еще в 2020-м. До сих пор не дописал.  — Сходил в подкаст, из которого меня выгнали из-за технической неподготовленности.  — Не смог договориться о компенсации в подкасте, который зарабатывает рекламой.  — Начал писать пост про отказ от Гугла и не написал (впрочем, в Телеграме вышло несколько постов по мотивам).  — Купил PS5, а времени играть не купил. За год прошел одну игру.  — Купил Valve Index, но не прошел даже Half Life: Alyx.  — Не получил водительские права.  — Утопил телефон (старый).  — Украли велосипед (новый).  Рассказывайте, что у вас не получилось?",263
"Ух как меня бесят рассинхроны в интерфейсе. Например, когда отвравляешь новый твит, он сначала не появляется в ленте, а потом может появиться дважды. Или когда поключаешь наушники через Bluetooth меню и оно пишет Connected, а соседняя иконка громкости все еще не поменялась. Или галочки в Github Actions: лог бежит вперед, а группы помечаются выполненными только через секунду-две.  Казалось бы: ну договоритесь, вся информация у вас есть, я своими глазами вижу, что нарисована самопротиворечивая ерунда. А компьютер не видит. Потому что нет single source of truth, данные никто не нормализует и во всем мире, кажется, осталась только eventual consistency.  В том смысле что eventually мы все умрем, и переживать будет уже некому.",264
