msg_content,msg_id
"Слушал подкаст DevZen с организаторами ICFPC 2020, и Павел Егоров (или кто-то другой), рассказывая кучу интересных фактов про историю реальных попыток общения землян (нас, то бишь) с инопланетянами, в какой-то момент обронил: «представляете, уже в 60-х годах ученые составили и отправили первое сообщение». Меня, собственно, именно это «представляете» больше всего позабавило. Потому что оно было бы уместно, скажем, в области медицины: представляете, в 60-х уже лечили Х. Или промышленности: представляете, в 60-х уже производили Y тонн, не знаю, автомобилей. Или представляете, в 60-х уже летали на Луну, прям как мы сейчас (что?)  Но в области общения с инопланетянами, кхм, как бы это сказать, прогресса с 60-х годов особо не было. Ну не идут инопланетяне на контакт! А без инопланетян наука общения с инопланетянами не сильно развивается. Зато люди, люди в 60-х, понятно, жили примерно такие же умные, как и сейчас (люди вообще, в среднем, одинаково умные во все периоды, только среда разная). Так что до чего бы мы ни могли додуматься сегодня, люди 60-х могли додуматься ровно с таким же успехом. Что они и сделали, причем довольно остроумно: почитайте, например, про послание Аресибо.",2
"Всю жизнь считал, что люди, которые ленятся в смайлике поставить двоеточие, скажем максимально тактично, СИЛЬНО ОШИБАЮТСЯ. ) — нет. :) — да. А сейчас сам собрал кастомную клавиатуру, на которой кнопок не очень много, и, кхм, оптимизировал раскладку. В русской пострадало двоеточие и еще кое-какая пунктуация, и руки теперь сами ленятся ставить смайлы. И тут меня осенило! Ну конечно, в обычных клавиатурах двоеточие тоже скачет между раскладками, в результате чего люди иногда даже просто на английский обратно переключаются, чтобы его набрать. Понятно, в каком-то литературном тексте такие усилия еще можно как-то оправдать, но в переписке — точно нет. Такая теория.",4
"Одна из немецких странностей, про которые почему-то очень мало говорят, и нет, это не штраф за убийство осы, это то, что двери в подъездах здесь открываются вовнутрь. Стоп, а России как? Вот именно, никогда бы не задумался, если бы не переехал. В России наружу. И да, это записывается напрямую на подкорку, минуя сознание. Так что первый месяц тут ты будешь дергать ручку не в ту сторону, чувствовать себя дураком и гадать, откуда это чувство враждебности окружающего мира. Хорошо, что я Нормана читал, он разрешил иметь проблемы с дверями и все равно считать себя нормальным человеком.",7
"Пытаясь соединить проектор у задней стены комнаты с колонкой у стены передней, я кое-что узнал:  - Колонки с сабвуфером на российском рынке почему-то называются «домашним кинотеатром». Просто колонки, без экрана, без проектора, без всего. - В Bluetooth Audio заложена задержка в районе 200 мс (на самом деле она бывает разная, зависит от кодека, размера буфера и т.п., но всегда консистентно большая). То есть для кино Bluetooth Audio более чем бесполезно. - Умные видео-плееры про это знают и искуственно задерживают видео, если отдают звук через bluetooth. Да, даже YouTube. Как программист, мне немного страшно от глубины протекания абстракции здесь. - Наблюдать задержку в bluetooth-наушниках очень просто, если сделать что-то интерактивное. Очистить корзину, например, понажимать кнопки в vim с включенным audiable bell, ну или в игру поиграть. - Другой вариант — начать подключать bluetooth-наушники, не останавливая YouTube видео. Как минимум видеоряд начнет заикаться на пару секунд, а как максимум все встанет таким раком, что веб-страницу придется перезагружать, а наушники переподключать. - Есть проприетарный кодек Apt-X с задержкой в ~120 мс. Все еще много, плюс его должны уметь и источник, и наушники/колонка. - Есть его малораспространенная версия aptX LL (low latency), дающая задержку в 40 мс. - На Алиэкспрессе можно купить трансмиттер и ресивер, в каждый из которых втыкается обычный 3,5 мм джек (иногда даже оптическое аудио!), а они передают звук между собой по aptX LL. По простоте использования это как аудио кабель, только без кабеля. И, главное, никакой завязки ни на софт, ни на возможности железа — от самих устройств требуется только аудио вход/выход. - Это работает! Уже года четыре я смотрю кино и играю в игры именно так. - На геймпадах Xbox и PlayStation есть Headphone Jack, видимо, по той же причине: на обычных bluetooth наушниках вы не смогли бы играть из-за задержки.  Внимательный читатель мог заметить, что задержка в 40 мс это хоть и мало, но больше нуля. То есть я смотрю кино просто чуть по-лучше, но все еще плохо? Тут вскрылось еще несколько фактов.  - Люди способны замечать задержку от 12 мс, если сами производят звук, например, при игре на музыкальных инструментах. - В ТВ стандартах приемлимой считается 40/60 мс. - Задержка менее 100 мс считается необнаружимой.  Так что 40 мс это вполне неплохо, особенно для кино. Но, если честно, я и в играх никакой задержки не ощущаю.",8
"Году так в 1996-м, примерно, я учился в шестом классе. И у нас была информатика. Компьютеров, в принципе, хватало на всех, но это были какие-то старые унылые советские ЭВМ. И был один ПК, который мало кто из нас, понятно, видел раньше, и к которому пускали только любимчиков препода. Меня пускали. Но история про то, что в какой-то момент на пару первому ПК купили второй и поставили рядом. И препод даже хвастался, что соединил их в сеть. Сеть, понятно, на тот момент была штукой еще более неслыханной, даже для тех, у кого дома были ПК. Поэтому моей целью стало создать такую ситуацию, в которой сеть зачем-нибудь бы пригодилась.  В какой-то момент мне это удалось: потребовалось под вполне логичным предлогом перекинуть какой-то файл с одного ПК на второй. Я зову препода и говорю: во, давайте, показывайте, как вы это по сети делаете. Он берет дискету, вставляет в комп, копирует на нее файл, вытаскивает, вставляет в соседний и копирует с дискеты. Все это сопровождается фразой «Да так проще». Финиш.  Сказать, что я был поражен, значит ничего не сказать. Это один из самых сильных уроков, которые я получил про компьютеры, технологии, юикс, продукты и прогресс в целом. И с каждым годом он становится все сильнее, потому что передать файл с одного компа на другой, даже в одной комнате, даже в одной сети, до сих пор проще всего флешкой. С момента осознания мной этого факта прошло уже 24 года.",10
"Посмотрел Знаки М. Найт Шьямалана (2002) и там есть все, кроме цветокоррекции и компьютерной графики. И как же это прекрасно! В современном цифровом кинопроизводстве цветокоррекцию любят, потому что, ну, с компьютерами это просто, дешево, скрывает какие-то огрехи в материале, и типа создает настроение. Даже не просто любят, а прям пихают практически везде. Для меня же она переводит картинку из категории «вот что случилось с настоящими людьми, в настоящем месте» в категорию «это все понарошку, мы тут нафантазировали, а потом еще фломастерами раскрасили». Чем больше трюков, тем меньше доверия. И как же клево смотреть кино относительно старое, когда этого еще не умели.  С компьютерной графикой та же штука — доверия меньше. Uncanny valley еще, даже у неживых предметов: домов, деревьев, морей — все равно всегда чувствуется, где настоящее, а где нет. В The Mandalorian (2020), как бы безупречно он ни выглядел, чувствуется, что они всю съемку тусили в павильоне, а в The Phantom Menace (1999) ездили в пустыню. И настоящее всегда круче.",11
"Проблема с Ведьмаком 3 в том, что после него решительно невозможно играть в другие игры. Не из-за геймплейных качеств, а исключительно из-за диалогов. В Ведьмаке хороший литературный текст, и, оказывается, это явление для игр практически уникальное.   В сценарном деле есть понятие планов диалога: первый это то, что произносится, сами слова. Второй — то, что герои думают и хотят на самом деле. Например, в Goodfellas есть гениальная сцена, где руководство мафии приходит к жене Рэя Лиотты и начинает убеждать ее не бросать мужа из-за измены. За всю сцену звучат только правильные слова: семейные ценности, любовь, поддержка, как они нужны друг другу. Ничего, кроме этих слов, не произносится. Гениальность же в том, что мы как зрители в этот момент уже в курсе, что им, в общем, по каким-то там причинам удобна стабильность и отсутствие скандала вокруг этой семьи, а в семейные ценности ни в какие разумеется никто из них не верит. Иногда вводят также понятие третьего плана — это мир и окружение, которые так или иначе отражаются в поведении/диалогах, но еще более косвенно.  Так вот, когда ты проходишь ворота Новиграда, и стоящий рядом охранник не останавливает тебя, но бурчит едва слышно что-то про то, что вот, развелось уродов, ты происходящее легко считываешь на всех уровнях: и что он старый служака, и что жизнь у него не сладкая, и стоит он уже на посту минимум полдня, и ему скучно, и злость надо куда-то выместить, а тут как раз ведьмак мимо проходил. И вопросов, почему он там стоит, нет, и почему в такой форме, да и остальную его жизнь можно легко представить. Everything checks out. И это не NPC даже, это так, антуражная фигурка даже скорее.  На самом деле, внутренняя логичность происходящего большая редкость не только среди игр. Ко многим фильмам и сериалам так же много вопросов, даже на уровне кто эти люди и что они тут делают, не говоря уж о том, почему они так себя ведут. Даже новый сериал по Ведьмаку такими мелочами не сильно заморачивался, ограничиваясь минимум фраз-экспозиций и торопясь поскорее переходить к рубилову.  Но с играми, с играми все гораздо хуже. Казалось бы, ты создаешь целый фантастический мир с нуля, и вроде бы хочешь максимально игрока туда погрузить, да? Но ведь ничто не погружает так сильно и глубоко, как внутренняя логичность происходящего.  Я пытаюсь играть в Horizon Zero Dawn, но это какой-то несмешной детский спектакль, по уровню проработки, конечно. Герои просто говорят прямо, что думают. А если не говорят, то логика всего остального подводит настолько, что нормально их действия не объяснить. Например, в племени есть изгои, видимо, чем-то провинившиеся. Нормальные с ними не разговаривают, что логично, видимо, их пугают. Но есть моменты, где сами изгои боятся разговаривать, хотя, казалось бы, этим-то чего терять? Или когда начальник стражи невзлюбил героиню, потому что... что? А ничего, просто. Никак не объясняется.  Казалось бы, учитывая игровые бюджеты, можно было бы и заплатить нормальному писателю. Сколько он может стоить? Больше 45 миллионов евро, видимо.",12
"Учитывая все вышесказанное, играть я предпочитаю в игры, где понятно, в чем, собственно, геймплей. Немножко экспозиции мне не мешает, но желательно, чтобы в какой-то момент тебе объяснили правила, отдали управление, и дальше ты сам по себе. А то некоторые игры это такой затяжной туториал, где от тебя ничего особо не зависит, джойстик тебе дают подержать чисто для виду, а главная твоя задача — усердно высидеть все кат-сцены. Нет, мне нравится, когда каждую секунду от тебя требуется принимать имеющие последствия решения, и это не иллюзия выбора, а дейсвительно то, что влияет на твой успех. То есть чтобы можно было не только выиграть, но и проиграть. По-настоящему.  Текущий фаворит — Dead Cells. Это такой Принц персии на спидах, причем очень сильных. Для меня это впервые, но я туда прямо провалился уже часов на сто и не могу остановиться. Примерно как с семечками — невозможно перестать щелкать (для миллениалов ближайший аналог — пупырчатая пленка). Идеал вовлечения, надо в университетах преподавать.  Как у них это получается? Я думаю, никто точно не сможет сказать. Просто все элеметны в этом конкретно случае сложились очень удачно: gameplay feel, вариативность, мета-прогресс, музыка. Но вот про текст хочу сказать. Сам текст не стремится кого-то особо рассмешить, а ирония сквозит скорее через сам мир и обстановку, чем через редкие текстовые кусочки. Примерно как в Fallout 1 — вроде в диалогах никто не шутит, все серьезно, вопросы жизни и смерти, но если посмотреть на ситуацию в целом, то без улыбки на это смотреть невозможно. Dead Cells, конечно, куда менее масштабна, но баланс выдержан примерно похожий. Это тонкая грань, и я могу только очень глубокий респект по этому поводу выразить. Выражаю: респект.",13
